{
  "ast_version": "1.0",
  "type": "Document",
  "position": { "start_line": 1, "start_col": 1, "end_line": 1, "end_col": 13 },
  "children": [
    {
      "type": "Paragraph",
      "position": { "start_line": 1, "start_col": 1, "end_line": 1, "end_col": 13 },
      "children": [
        {
          "type": "Text",
          "position": { "start_line": 1, "start_col": 1, "end_line": 1, "end_col": 13 },
          "text": "Hello world."
        }
      ]
    }
  ]
}
