{
  "ast_version": "1.0",
  "type": "Document",
  "position": { "start_line": 1, "start_col": 1, "end_line": 10, "end_col": 1 },
  "children": [
    {
      "type": "CodeBlock",
      "position": { "start_line": 1, "start_col": 1, "end_line": 4, "end_col": 4 },
      "fenced": true,
      "lang": "rust",
      "info": "rust no_run",
      "text": "fn main() {\n    println!(\"hi\");\n}\n"
    },
    {
      "type": "CodeBlock",
      "position": { "start_line": 6, "start_col": 1, "end_line": 6, "end_col": 12 },
      "fenced": false,
      "lang": null,
      "info": null,
      "text": "indented\n"
    },
    { "type": "ThematicBreak", "position": { "start_line": 8, "start_col": 1, "end_line": 8, "end_col": 4 } },
    {
      "type": "HtmlBlock",
      "position": { "start_line": 10, "start_col": 1, "end_line": 10, "end_col": 14 },
      "text": "<div>raw</div>"
    }
  ]
}
